,Speaker,Utterance,Unified
5,B,"And my in-laws also have one, and they're almost as close.","B|And my in-laws also have one, and they're almost as close."
6,M,My parents have a similar one.The only thing i can think of is that it's a special type of water.,M|My parents have a similar one.The only thing i can think of is that it's a special type of water.
7,B,They're in Richardson.,B|They're in Richardson.
8,M,Where do you live?,M|Where do you live?
9,B,"Um, usually, uh, word processing something, um, such as, oh, forms for things, uh,","B|Um, usually, uh, word processing something, um, such as, oh, forms for things, uh,"
10,M,What do you mean?,M|What do you mean?
11,B,also I have a nine year old that I've been home schooling for the last three years.,B|also I have a nine year old that I've been home schooling for the last three years.
12,M,"Oh, I've never been home schooled.","M|Oh, I've never been home schooled."
13,B,"And we got, uh, the one that my parents have is an Apple Two E.","B|And we got, uh, the one that my parents have is an Apple Two E."
14,M,"Ah, okay.","M|Ah, okay."
15,B,"And I have a sister-in-law who is, who works in the Fort Worth school district.","B|And I have a sister-in-law who is, who works in the Fort Worth school district."
16,M,It's my sister in law's name.,M|It's my sister in law's name.
17,B,"And so she got me copies of, uh, several of the Apple programs for school programs,","B|And so she got me copies of, uh, several of the Apple programs for school programs,"
18,M,Uh... um...,M|Uh... um...
19,B,"and so we use those and there's some, whenever we go over and visit grandma the kids love to play the computer game, so, that's part of it.","B|and so we use those and there's some, whenever we go over and visit grandma the kids love to play the computer game, so, that's part of it."
20,M,I just like to play games with my mom.,M|I just like to play games with my mom.
21,B,"Um, my husband has used the one at his folks house for mostly business things. Uh, his resume, his, uh, letter,","B|Um, my husband has used the one at his folks house for mostly business things. Uh, his resume, his, uh, letter,"
22,M,How does one use a computer?,M|How does one use a computer?
23,B,"he's been applying for jobs and things, so that type of thing. Uh, forms for his photography business, and that kind of thing.","B|he's been applying for jobs and things, so that type of thing. Uh, forms for his photography business, and that kind of thing."
24,M,"Wait, what?","M|Wait, what?"
25,B,Yeah.,B|Yeah.
26,M,"uh, uh, how did you get these?","M|uh, uh, how did you get these?"
27,B,"I'm, uh, my father had a software company,","B|I'm, uh, my father had a software company,"
28,M,Oh. That's cool.,M|Oh. That's cool.
29,B,and they have a bunch of computers leftover from that,B|and they have a bunch of computers leftover from that
30,M,I wonder what that's like.,M|I wonder what that's like.
31,B,"and we're hoping that they can put together something for us here that we can have the word processing, here","B|and we're hoping that they can put together something for us here that we can have the word processing, here"
32,M,"They have a computer and a radio, and a computer.","M|They have a computer and a radio, and a computer."
33,B,"But, um, they're kind of old older","B|But, um, they're kind of old older"
34,M,"Yeah, it's a little bit older.","M|Yeah, it's a little bit older."
35,B,"so I'm not sure that we'll be able to do, get too many other programs for it.","B|so I'm not sure that we'll be able to do, get too many other programs for it."
36,M,"We have a program for that, we'll just have to see what it is.","M|We have a program for that, we'll just have to see what it is."
37,B,Oh. I have one of those. Yeah.,B|Oh. I have one of those. Yeah.
38,M,...,M|...
39,B,"Mine's broke at the moment, but","B|Mine's broke at the moment, but"
40,M,I'm not.,M|I'm not.
41,B,Oh.,B|Oh.
42,M,I have a. 22 in my living room.,M|I have a. 22 in my living room.
43,B,"Yeah, I learned, I, I learned Wordstar, uh, I did some typing for my father when he had the company","B|Yeah, I learned, I, I learned Wordstar, uh, I did some typing for my father when he had the company"
44,M,Did you learn that?,M|Did you learn that?
45,B,"and so I learned that on there too, that was,","B|and so I learned that on there too, that was,"
46,M,...,M|...
47,B,"I haven't. That's the one that my father, well, I guess I have used it once or twice.","B|I haven't. That's the one that my father, well, I guess I have used it once or twice."
48,M,"You can't spell, I mean, have you ever been able to spell?","M|You can't spell, I mean, have you ever been able to spell?"
49,B,"Uh, it's the one that's on my father-in-law's computer.","B|Uh, it's the one that's on my father-in-law's computer."
50,M,You've never used it?,M|You've never used it?
51,B,He's got on I B M.,B|He's got on I B M.
52,M,I'm guessing he has an I M in his computer.,M|I'm guessing he has an I M in his computer.
53,B,"And, uh, so that's the program that they're using there.","B|And, uh, so that's the program that they're using there."
54,M,"I know, but it's on the computer in my room.","M|I know, but it's on the computer in my room."
55,B,That's what I've heard.,B|That's what I've heard.
56,M,Nomroads.,M|Nomroads.
57,B,Uh-huh.,B|Uh-huh.
58,M,"I,","M|I,"
59,B,"Yeah, you had to, memorize it,","B|Yeah, you had to, memorize it,"
60,M,"Did you know,","M|Did you know,"
61,B,"and,","B|and,"
62,M,"No, you had a spellchecker","M|No, you had a spellchecker"
63,B,"Oh. Oh, that's neat.","B|Oh. Oh, that's neat."
64,M,It's the other way around.,M|It's the other way around.
65,B,"Oh, how wonderful.","B|Oh, how wonderful."
66,M,...,M|...
67,B,"That, I had heard that that was better. That was a better one.","B|That, I had heard that that was better. That was a better one."
68,M,"I, uh, you, you mean that?","M|I, uh, you, you mean that?"
69,B,"Yeah. Yeah, I agree","B|Yeah. Yeah, I agree"
70,M,"I think it's the most fun, the most interesting, and the least spoiled","M|I think it's the most fun, the most interesting, and the least spoiled"
71,B,"Not too much. What kind of, what kind of things do you write?","B|Not too much. What kind of, what kind of things do you write?"
72,M,You?,M|You?
73,B,Oh,B|Oh
74,M,"Well, I was just a writer.","M|Well, I was just a writer."
75,B,to her Go talk to Daddy about it. Excuse me.,B|to her Go talk to Daddy about it. Excuse me.
76,M,I have no idea what you're talking about,M|I have no idea what you're talking about
77,B,to her Go on and talk to Daddy about it Tell Daddy I unplugged it for you. But you don't need to drag it down the hall,B|to her Go on and talk to Daddy about it Tell Daddy I unplugged it for you. But you don't need to drag it down the hall
78,M,"Yes, but it was in the attic.","M|Yes, but it was in the attic."
79,B,"Daddy, Daddy came home and found her playing with the telephone that I had unplugged","B|Daddy, Daddy came home and found her playing with the telephone that I had unplugged"
80,M,I'm sorry for your loss.,M|I'm sorry for your loss.
81,B,Yeah.,B|Yeah.
82,M,Yeah. It's like he's gonna be back.,M|Yeah. It's like he's gonna be back.
83,B,Huh.,B|Huh.
84,M,... she's an artist,M|... she's an artist
85,B,Yeah.,B|Yeah.
86,M,"I'm... schl'er, sch... er... schm, I mean... schoo'er...","M|I'm... schl'er, sch... er... schm, I mean... schoo'er..."
87,B,Yeah. I'm anxious some day to have one here.,B|Yeah. I'm anxious some day to have one here.
88,M,Oh. I am?,M|Oh. I am?
89,B,"I'm, and they just talked to the other day other day about setting something up again so hopefully pretty soon we'll at least have the word processing.","B|I'm, and they just talked to the other day other day about setting something up again so hopefully pretty soon we'll at least have the word processing."
90,M,"Oh. Well, yeah.","M|Oh. Well, yeah."
91,B,"My nine year old I've decided to teach her how to type using the computer,","B|My nine year old I've decided to teach her how to type using the computer,"
92,M,"Well, what is it?","M|Well, what is it?"
93,B,so.,B|so.
94,M,I'm not good at typing.,M|I'm not good at typing.
95,B,Yeah.,B|Yeah.
96,M,You can type on the computer?,M|You can type on the computer?
97,B,"I've,","B|I've,"
98,M,I have.,M|I have.
99,B,That's right.,B|That's right.
100,M,She's not going to have any of those.,M|She's not going to have any of those.
101,B,Uh-huh. Yeah.,B|Uh-huh. Yeah.
102,M,"Uh, what?","M|Uh, what?"
103,B,"We've been, we've been, uh, writing a story together.","B|We've been, we've been, uh, writing a story together."
104,M,He smiles and nods.,M|He smiles and nods.
105,B,"And so I, and I wanted her to put it into the computer, and then print it out and, make a book with it, you know.","B|And so I, and I wanted her to put it into the computer, and then print it out and, make a book with it, you know."
106,M,What?,M|What?
107,B,"And so I decided well, if she's going to do that, it would be a whole lot easier if she could type","B|And so I decided well, if she's going to do that, it would be a whole lot easier if she could type"
108,M,Oh. She could've just typed it out.,M|Oh. She could've just typed it out.
109,B,So we'll slowly learn just to type here and then then put the story in.,B|So we'll slowly learn just to type here and then then put the story in.
110,M,I've been told by others to make a story.,M|I've been told by others to make a story.
111,B,"Yes, yes. I agree.","B|Yes, yes. I agree."
112,M,I agree. She can still learn to type.,M|I agree. She can still learn to type.
113,B,Yeah.,B|Yeah.
114,M,She shrugs. I've been in a relationship for a while.,M|She shrugs. I've been in a relationship for a while.
