,Speaker,Utterance,Unified
5,M,"Well, that's what I'm saying.","M|Well, that's what I'm saying."
6,A,you know what I mean?,A|you know what I mean?
7,M,"I know, uh huh.","M|I know, uh huh."
8,A,Yeah.,A|Yeah.
9,M,"Yeah, I know.","M|Yeah, I know."
10,A,Right.,A|Right.
11,M,right.,M|right.
12,A,That's it.,A|That's it.
13,M,There is no way that I could live with that.,M|There is no way that I could live with that.
14,A,"Well, I, I feel the other thing too, uh, they were saying, uh, you know, what new ways could could it, you, you know, change the system. I, I really think that, uh, we spend a lot of time, uh, going through appeal after appeal after appeal after appeal, I mean, if you go to a trial by jury and especially if a person has confessed. If they have been caught, you know, point blank in the crime. There's, uh, no question","A|Well, I, I feel the other thing too, uh, they were saying, uh, you know, what new ways could could it, you, you know, change the system. I, I really think that, uh, we spend a lot of time, uh, going through appeal after appeal after appeal after appeal, I mean, if you go to a trial by jury and especially if a person has confessed. If they have been caught, you know, point blank in the crime. There's, uh, no question"
15,M,.,M|.
16,A,"it's beyond a reasonable doubt. You know, all these things. I mean, you know, we've gone through this over and over again.","A|it's beyond a reasonable doubt. You know, all these things. I mean, you know, we've gone through this over and over again."
17,M,"You can't, or we know,","M|You can't, or we know,"
18,A,"And it can go on for ten, twenty, years.","A|And it can go on for ten, twenty, years."
19,M,I'm not.,M|I'm not.
20,A,"I, I think this is a little ridiculous.","A|I, I think this is a little ridiculous."
21,M,"Well, the trial is a bit of a stretch.","M|Well, the trial is a bit of a stretch."
22,A,I think the only people who benefit from that are the lawyers.,A|I think the only people who benefit from that are the lawyers.
23,M,"Well, I know what I'm doing with my life.","M|Well, I know what I'm doing with my life."
24,A,"I, I'm serious. And I think that the lawyers have caused a lot of the problems that exist in the in the criminal system today. With plea bargaining.","A|I, I'm serious. And I think that the lawyers have caused a lot of the problems that exist in the in the criminal system today. With plea bargaining."
25,M,I'm serious. I'm pretty sure that there are a lot more of those people in the legal system than you think.,M|I'm serious. I'm pretty sure that there are a lot more of those people in the legal system than you think.
26,A,"You know, if someone is","A|You know, if someone is"
27,M,I think he's a sociopath.,M|I think he's a sociopath.
28,A,Well.,A|Well.
29,M,I know it. I'm a lawyer.,M|I know it. I'm a lawyer.
30,A,"Well, I know. That's what I'm saying. But I think a lot of, all of the whole criminal system is messed up in, in that regard. I mean, you know, people who commit, uh, crimes that they, I don't know how it works exactly  but  you know, they get lesser sentences","A|Well, I know. That's what I'm saying. But I think a lot of, all of the whole criminal system is messed up in, in that regard. I mean, you know, people who commit, uh, crimes that they, I don't know how it works exactly  but  you know, they get lesser sentences"
31,M,"But, I don't know, that's the whole system.","M|But, I don't know, that's the whole system."
32,A,"and I understand that the jails are full of people, you know, uh  and that they have to do something.","A|and I understand that the jails are full of people, you know, uh  and that they have to do something."
33,M,That's what the,M|That's what the
34,A,"But, I think that the reason they are full is because they know that they can get away with it.","A|But, I think that the reason they are full is because they know that they can get away with it."
35,M,"Yeah, they know.","M|Yeah, they know."
36,A,"you know what I'm saying? That we don't have, uh, well a lot of states don't have capital punishment.","A|you know what I'm saying? That we don't have, uh, well a lot of states don't have capital punishment."
37,M,... because we're a state.,M|... because we're a state.
38,A,"And, uh I, I think they should.","A|And, uh I, I think they should."
39,M,I think you should get rid of capital punishment.,M|I think you should get rid of capital punishment.
40,A,"I, and I think if a person is guilty of taking someone's life and like you say, it's, it's, there's no doubt whatsoever. Like drunk drivers that kill people and, uh, you know, all","A|I, and I think if a person is guilty of taking someone's life and like you say, it's, it's, there's no doubt whatsoever. Like drunk drivers that kill people and, uh, you know, all"
41,M,I think you misunderstand what I am saying.,M|I think you misunderstand what I am saying.
42,A,"they, they're caught dead to rights. I, I just think that that's, they've, they've taken a life and if, they should pay for it with their life.","A|they, they're caught dead to rights. I, I just think that that's, they've, they've taken a life and if, they should pay for it with their life."
43,M,It's a quote from the movie'The Prestige '.,M|It's a quote from the movie'The Prestige '.
44,A,Yeah.,A|Yeah.
45,M,"No, I'm, uh, I am.","M|No, I'm, uh, I am."
46,A,Uh-huh.,A|Uh-huh.
47,M,What do you mean?,M|What do you mean?
48,A,"Oh, really.","A|Oh, really."
49,M,"No, he didn't. He was arrested.","M|No, he didn't. He was arrested."
50,A,"It, uh, Yeah.","A|It, uh, Yeah."
51,M,He got out?,M|He got out?
52,A,"I know that, that  Uh-huh. And, I don't know. Uh, what would you do to change it? To make it better?","A|I know that, that  Uh-huh. And, I don't know. Uh, what would you do to change it? To make it better?"
53,M,"It's u I Am The Law, I know.","M|It's u I Am The Law, I know."
54,A,"Oh, yeah. I, I, I don't agree with that at all.","A|Oh, yeah. I, I, I don't agree with that at all."
55,M,Yes.,M|Yes.
56,A,Imagine the guilt that person would have. I mean  burned out.,A|Imagine the guilt that person would have. I mean  burned out.
57,M,"You... I don t, I?","M|You... I don t, I?"
58,A,"There's  there's no possible way that you could, uh, you know, feel good about yourself.","A|There's  there's no possible way that you could, uh, you know, feel good about yourself."
59,M,I... I don't know.,M|I... I don't know.
60,A,"If you had to do something like that, day after day.","A|If you had to do something like that, day after day."
61,M,I feel like that would be a good way to go.,M|I feel like that would be a good way to go.
62,A,No. Not really.,A|No. Not really.
63,M,So what do you think is the ideal outcome?,M|So what do you think is the ideal outcome?
64,A,"Well, do you think people should have a trial is they're caught dead to rights like,","A|Well, do you think people should have a trial is they're caught dead to rights like,"
65,M,"Yes, because the people who were arrested are guilty of murder.","M|Yes, because the people who were arrested are guilty of murder."
66,A,"I mean, supposing I come up to you and I just point blank kill you.","A|I mean, supposing I come up to you and I just point blank kill you."
67,M,How do you know that?,M|How do you know that?
68,A,"In other words you're saying that, you have to find out whether it's premeditated or what the circumstances were.","A|In other words you're saying that, you have to find out whether it's premeditated or what the circumstances were."
69,M,I'm saying that there is a difference between being right and being right.,M|I'm saying that there is a difference between being right and being right.
70,A,Yeah.,A|Yeah.
71,M,I'm pretty sure you can.,M|I'm pretty sure you can.
72,A,Yeah.,A|Yeah.
73,M,That's what I said.I think that you can remove the judge.But can't you remove the defendant.And it's not like there's a jury.,M|That's what I said.I think that you can remove the judge.But can't you remove the defendant.And it's not like there's a jury.
74,A,"Well, I, I,","A|Well, I, I,"
